text,category
"Мой ребенок просто без ума от этого детского велосипеда! Руль и педали легко регулируются по высоте. Но цена... Ох, цена!",товары для детей
"Такие забавные игрушки, особенно для маленьких детей. Моему малышу просто необходим этот погремушка. Только вот я бы не стал ставить ее в холодильник. Она там здорово гудит, но потом звук исчезает.",товары для детей
"Весело с ними играем, но батареи быстро садятся, жаль.",товары для детей
Самый лучший кукольный домик! Ребенок обожает играть в маму и папу!,товары для детей
"Был очень рад покупке, но моему ребенку этот развивающий набор скучен после пары недель использования.",товары для детей
Товар супер! Дети в восторге от новых головоломок и игрушек!,товары для детей
"Хороший продукт, но мне кажется цена завышена для такого небольшого набора игрушек.",товары для детей
Мой ребенок обожает свою новую игру. Ему не надоедает её играть каждый день.,товары для детей
"Впечатления противоречивые. Нравится качество, но не устойчивость к повреждениям от игры.",товары для детей
Очень рекомендую эти карандаши для детского рисования. Они яркие и безопасные.,товары для детей
"Качество игрушек отличное, держалось хорошо, дочь в восторге, а вот цена - кусается немного.",товары для детей
"Мой ребенок просто в восторге от этой кроватки-трансформера. Она удобная и красивая, хоть и стоит дорого.",товары для детей
"Даже не ожидал, что эти детские велосипеды настолько легкие и прочные. Ребенок сам управляется отлично.",товары для детей
Ужасное качество рюкзака для школы. Застежки уже сломались после месяца использования. Не рекомендую.,товары для детей
"Очень полезные книги для обучения чтению! Книги легко читаются, интересные и содержательные. Благодарна продавцам за выбор!",товары для детей
"Эта детская коляска просто супер! Маневренная, удобная и стильная, все положительные моменты. Но цена... Осталась в шоке.",товары для детей
"Музыкальные инструменты для детей - это замечательный подарок. Дочка любит их звучание, хотя качество сборки может быть лучше.",товары для детей
"Бассейн для малышей - идеальное решение для летних прогулок. Но он не вписывается в мой бюджет, поэтому жаль.",товары для детей
Ура! Мой ребенок в полном восторге от этой игрушки-конструктора. Он играет им по несколько часов подряд. Качество - отличное. Рекомендую!,товары для детей
"Очень разочарован, качество пластиковой детали могло быть лучше. Немного расстроен покупкой.",товары для детей
Книги для детей от этого издательства всегда интересны и развивающие. Мои дети их любят. Спасибо за прекрасный выбор!,товары для детей
"Покупал для ребенка на новый год, но он быстро изнашивается. Может быть, стоит поискать более прочные варианты. Оценка 3 из 5.",товары для детей
"Заказал детский стульчик, но он слишком тяжел для моей маленькой дочки. Больше подходит для взрослых. Буду искать другие варианты.",товары для детей
Все любят этот детский коврик с картинами животных. Яркие цвета привлекают внимание. Хороший вариант для обучения цветам.,товары для детей
"Ребенку очень понравился этот детский велосипед, но он немного тяжеловат. Ищем более легкий вариант.",товары для детей
Это лучшая книга о путешествиях для детей! Содержит много интересной информации. Покупайте без сомнений!,товары для детей
"Моему малышу очень понравился этот развивающий кубик, цвета яркие, детям точно нравится играть! Только вот упаковка могла быть более прочной.",товары для детей
"Очень обидно, что игрушка пошла в рваные через месяц. Не ожидал от этого бренда. Оцениваю товар 2 из 5 звезд.",товары для детей
Игровая кухня - отличное приобретение! Мой ребенок любит проводить там часами. Качество материалов очень хорошее.,товары для детей
"Все довольны - и мамы, и дети! Ребенку просто необходимо было это пальчиковое книжки-игрушки. Они отлично развивают мелкую моторику рук.",товары для детей
"Детишки были в восторге от этих развивающих мозаики, но я бы хотел, чтобы они были немного больше для большей безопасности.",товары для детей
"Замечательный набор для творчества! Дети могут быть вдохновлены своей работой. Несмотря на небольшие размеры, качество и цвета впечатляющие.",товары для детей
"После покупки детской кроватки я была в шоке, она была слишком маленькая для моего ребенка. Думала, что по размерам все хорошо, но не учла возраст. Будьте осторожнее при выборе.",товары для детей
"Сначала казалось, что это слишком дорогие игрушечные машинки, но когда я увидела, как моему ребенку это нравится, поняла, что цена того стоит.",товары для детей
"Моему сынишке просто нравится этот детский велосипед. Он легко управляем, даже моя маленькая дочка может ездить на нем. Стоит он недорого, что тоже радует.",товары для детей
"Этот набор для рисования в стиле 'художник на ходу' мне не понравился. Больше всего меня разозлило то, что его сложно собрать.",товары для детей
"С ребенком мы играем в эту палатку для малышей каждый день. Она прочная, не течет и легко устанавливается. Один из лучших вариантов, которые я видел!",товары для детей
"Купила эту кроватку для новорожденного. Неплохо, но я бы предпочел большее количество сеток для воздуха. И цена немного кусается.",товары для детей
"Этот набор для игры в куклы был очень сломан. Дети были разочарованы, а я расстроен из-за того, что он так дорого обошелся.",товары для детей
"Я заказал этот коврик для игр, надеясь на то, что он сделает мой дом безопасным для ребенка. Но он скользкий и не слишком удобный.",товары для детей
"Моим детям очень нравится этот музыкальный инструмент. Они любят ими играть, и это помогает развивать их мелкую моторику.",товары для детей
"Надежная и комфортная детская кровать. Единственное, что мне не нравится - это то, что ее невозможно установить в любом месте в комнате из-за размеров.",товары для детей
"Все в порядке, ребенку понравилось, только держателя для рисования маловато, ребенок постоянно что-то тянуть хочет. В общем, рекомендую!",товары для детей
"Удивился цене, качество просто замечательное. Нам подарили это магнитное полотно, детишки в восторге.",товары для детей
"Игрушка крутая, но детям она не очень нравится. Может, дело в том, что мальчишки любят крутые машинки. Может, лучше подойдет для девочек?",товары для детей
"Такое количество игрушек в коробке - это громадное количество разочарования. Качество игрушек, мягко говоря, сомнительное. Беспечное использование и непродуманная комплектация. Не рекомендую!",товары для детей
"Купил эти развивающие кубики, они действительно привлекают внимание ребенка. Даже я в них заинтересовался! Малыш любит их играть. Всем советую!",товары для детей
"Прекрасное качество, ребенку понравилось, а мне ещё и сэкономил время, потому что теперь он сам занимается своими игрушками. Отличное решение для занятий дома. Рекомендую!",товары для детей
"Моему ребёнку эта детская кроватка явно не понравилась. Она слишком высокая, он постоянно падает на пол, когда пытается самостоятельно вставать. В остальном всё хорошо, но эта особенность огорчила. Возможно, стоит обратить внимание на другие модели.",товары для детей
"Этот детский набор для настольного футбола был большим открытием. Несмотря на то, что ребенку было немного сложно понять правила игры, ему очень понравилось. Продукт действительно стоящее покупка. Рекомендую!",товары для детей
"Очень расстроился после покупки детского кресла. Неудобства при установке, а самое главное - ребенок не любит его. Больше не советую.",товары для детей
Это лучший набор детских пазлов! Мой ребенок влюбился в него сразу же и теперь с удовольствием собирает его каждый день!,товары для детей
Мне не понравилось качество детской одежды. Через две постирки она изнашивается. Следующий раз буду искать что-то другое.,товары для детей
Качество игры Маша и медведь - отличное! Настраивал его для ребенка и он в восторге. Спасибо за веселые часы!,товары для детей
Товары для детей от этого бренда - полная катастрофа. Они дорогие и не имеют нужного качества. Буду искать что-то другое в будущем.,товары для детей
"Детская коляска стоит своих денег. Держит очень стабильно, удобство для ребенка - отличное. Советую всем!",товары для детей
Мой ребенок обожает эти детские рюкзаки. Они прочные и стильные. Купил еще один на случай посещения дяди.,товары для детей
"Слишком дорогая цена за детский браслет-андроид. Он работает нормально, но моя дочка быстро надоела играть в него.",товары для детей
"Ох, эти игрушки! Они такие милые, и мой малыш просто обожает их. Но... иногда кажется, что они немного хрупкие. Если бы держались дольше, был бы только рад.",товары для детей
"Мой ребенок просто в восторге от этой детской кроватки! Она красивая, удобная, и очень проста в установке. Только я бы не советовал ее использовать более 3 лет, так как она может стать маловата.",товары для детей
"Большое разочарование от этих детских бутылочек. Они так дорогие, а просадка в температуре молока делает их непрактичными. Не рекомендую.",товары для детей
"Эти рюкзаки для малышей отличаются классическим дизайном и комфортным размером, они идеально подходят для моего ребенка. Впечатление только положительное.",товары для детей
"У моей дочки уже 3 года, она с радостью играет со своим кукольным домиком. Он прочный и имеет много функциональных элементов, которые она любит. Отличный выбор!",товары для детей
С этим набором инструментов для малыша мой сын стал настоящим помощником в моем доме. Они очень безопасны и качественные.,товары для детей
"Я очень расстроился после покупки этого коляски. Она была очень дорогой, но из-за своих размеров и веса ее сложно перемещать.",товары для детей
"Дочь в восторге от своей новой книжки-игрушки, которую я ей купил. Я же лишь надеюсь, что пластика на ней будет прочной и не начнет трескаться через пару месяцев использования.",товары для детей
"Детский стульчик - просто чудо! Удобно, безопасно, красивый дизайн. Качество на высоте. Спасибо производителю!",товары для детей
"Мой ребенок не любит этот детский матрас. Он слишком жесткий, малыш постоянно просыпается. Ожидали большего от такого дорогого товара.",товары для детей
"Коляска с колесиками на руках – удобно, но я бы хотел больше функциональности. Может, стоит продумать еще и подставку для бутылочки?",товары для детей
Безумно влюблена в эту игрушку! Мой ребенок ее просто обожает. Качество выше всяких похвал.,товары для детей
"Всё хорошо, пока не сломалась кукла. Не понимаю, почему производители делают игрушки так ненадежно. Сожалею о покупке.",товары для детей
"Это первая детская кроватка, которую мы купили и нам очень нравится. Она удобная, красивая и легко перестраивается на кроватку. Советую всем!",товары для детей
Я очень разочарован. Стул для кормления развалился спустя несколько недель. Качество товара не соответствует цене.,товары для детей
"Книги в наборе для чтения – это то, что нужно моему ребенку. Они развлекательны и развивающы, что важно для его развития.",товары для детей
"Купили развивающую игрушку для малыша. Сначала была в восторге, но через месяц игрушка начала давать дребезжание и перестала работать. Пожалуйста, сделайте лучше качество! 🙁",товары для детей
"Буквально взял в руки детский велосипед и понял, что для ребенка весом 40 кг он слишком тяжел. Не уверен, стоит ли его покупать. 😬",товары для детей
"Моему ребенку очень понравилась палатка на батарейках, но она быстро испортилась. Буду искать более прочную модель. ☹️",товары для детей
"Наклейки для двери из держателя магнита - это супер идея! Они красивые и легко убираются, но немного дороговаты. 😋",товары для детей
"С удовольствием использовал пластиковые коробки для хранения детских игрушек. Качество на высоте, удобство сборки - отличный вариант для организации пространства! 👍",товары для детей
"Детская коляска с поддержкой для головы - чудесная вещь. Она хорошо удерживает голову младенца, спасибо за эту функцию! 😊",товары для детей
"Был в восторге от детского стульчика для кормления. Он легкий, комфортный и не занимает много места. Плюс, он очень стильный! 👌",товары для детей
Развивающая книга с интерактивными элементами - это шикарно. Она держит внимание ребенка на протяжении долгого времени и учит новым словам. Очень рекомендую! 📚👍,товары для детей
"Боже, эти куклы-малютки супер милые! Удивительно, что они стоят так дешево. Моя дочка их просто обожает.",товары для детей
"Мой ребенок не может перестать играть с этим креслом-качалкой, и я не могу перестать замечать его радостное лицо. Великолепная покупка!",товары для детей
"Купил эту детский коляску с большими надеждами, но она постоянно ломается. Огорчен, жаль, что приходится снова искать вариант.",товары для детей
"Приятно удивлен, насколько мягкие и удобные эти матрасы для малышей. Моему бабушке было сложно найти что-то подходящее, но мы нашли это.",товары для детей
"Недавно купил этот набор для рисования, но детям не понравилось. Картонные коробки, внутри которых находятся краски, не выдерживают их энергии. Не рекомендую.",товары для детей
"Покупал эту игрушечную машину для моего сына, он ее уже сломал через неделю. Вместо того чтобы приобрести что-то долговечное, я остался недоволен.",товары для детей
Я был в восторге от этой детской кроватки. Она идеально подходит для моего ребенка и очень удобная для мамы. Однозначно рекомендую!,товары для детей
Моему сыну очень нравится эта подушка для спокойного сна. Он теперь спит лучше и просыпается с меньшим количеством капризов.,товары для детей
"Коляска для малышей - шикарная! Малышу очень комфортно, а я радуюсь, что выбор был правильным. Тут и удобная регулировка, и прочная рама, и большое количество функций.",товары для детей
"Детский стульчик для кормления не подвёл. Было немного проблем с доставкой, но зато сам продукт впечатляет. Сиденье мягкое, есть много настроек по высоте, ребенку понравилось сидеть и есть прямо за столом.",товары для детей
"Не рекомендую детские бутылочки с соской. Моя дочка отказывается пить из них. Качество, видимо, отличное, но моя девочка предпочитает старые. Остается только ждать новую поставку.",товары для детей
"Книжки-игрушки для маленьких - это то, что нужно. Яркие, большие, с большим количеством вкладышей. Но, к сожалению, они легко порвутся при неправильном использовании.",товары для детей
"Недавно приобрела куклу-подростка для девочки. Качество очень хорошее, детали выполнены отлично. Только вот размер для моей двукратной девочки немного большой, и приходится искать одежду для такой куклы.",товары для детей
