text,category
Блюдо обжигает при приготовлении. Контроль температуры не очень точный. Не рекомендую!,бытовая техника
"Ох, этот чайник настолько быстрый, что я даже удивлен! Рад за такие деньги.",бытовая техника
"Прибор работает на ура, мощь! Только вот сантехника за ним тяжело поддерживать.",бытовая техника
"Самый настоящий кухонный помощник. Огромная панель управления, но она быстро осваивается.",бытовая техника
"Телевизор впечатляет своей яркостью и четкостью изображения, но иногда он слишком шумит.",бытовая техника
"Холодильник впечатляет своей вместительностью, но иногда его трудно запустить после долгого отключения.",бытовая техника
Мой утюг - это забота о моем гардеробе. Но иногда он греется слишком сильно.,бытовая техника
"Мой посудомойка делает работу безупречно, но иногда она тратит слишком много воды.",бытовая техника
"Ну вот как всегда, купила новую посудомоечную машину и в первый же день она перестала включаться. Очень разочарована.",бытовая техника
"Квартира стала таким чистым и свежим благодаря моей новой пылесосной бомбе. Правда, иногда звук работы немного мешает.",бытовая техника
"Игнорирую минусы этого холодильника. Он работает отлично, сэкономил мне много места и времени!",бытовая техника
"Стоит попробовать это блендер! Он очень мощный и удобный, все смешивает моментально. Немного шумноват, но это мелочи.",бытовая техника
Кухонная плита меня впечатлила своей производительностью и удобством использования. Стоит каждой своих денег.,бытовая техника
"Мне не понравился этот микроволновка, он постоянно перегревается и часто перепадает в работе.",бытовая техника
"Этот умный холодильник меня превратил в домаохотового - он сам подсказывает, что нужно купить, когда запасы снизятся.",бытовая техника
"Мой увлажнитель воздуха вдруг перестал включаться. Качество продукта, видимо, не соответствует его цене.",бытовая техника
"Эта посудомоечная машина просто супер! Мощная, чистит отлично и еще и экономит воду. Рекомендую всем!",бытовая техника
"Уже месяц пользуюсь стиральной машиной, но вот смысла в ней до сих пор не понимаю. Иногда даже не работает. Не советую.",бытовая техника
"Был рад приобрести холодильник, но после нескольких месяцев в нем появляются конденсаты, не могу понять как это исправить.",бытовая техника
"Телевизор смотрится классно, но звук просто ужасен. Приходится постоянно включать дополнительный звук. Не стоит покупать.",бытовая техника
"Блендер работает хорошо, но иногда от него летят капли. Нужно было купить блендер помощнее.",бытовая техника
"Комплект кухонной техники в целом понравился, только духовой шкаф не очень надежный. Включается случайно, нужно было выбирать другой.",бытовая техника
"Приобрел кофемашину, но она часто перегревается. Приходится ждать долгие перерывы между кофе. Вряд ли буду ее рекомендовать.",бытовая техника
"Посудомоечная машина очень шумная, что мешает утренним упражнениям. Может стоило найти другое решение.",бытовая техника
"Холодильник классный, но вот дверцу иногда сложно закрываеться. Может, нужно просто привыкнуть? Не знаю, жду, когда все уляжется.",бытовая техника
"Ужасный микроволновка! Ничего не греет, все сухо. Больше не куплю этого бренда.",бытовая техника
"Удивительно, как эта стиральная машина может справляться с моими бельем за такие деньги! Качество превосходное!",бытовая техника
"Этот пылесос работает шикарно, только звук немного мешает. Пока радуюсь покупке!",бытовая техника
"Электроплитка изначально обещала много вкусной пищи, но уже через неделю перестала работать. Крайне разочарован.",бытовая техника
"Ох уж эти кофемашинки! Они и так дороги, а еще и ремонт требуют. Не рекомендую.",бытовая техника
"Вентилятор работает замечательно, но почему-то сбрасывает все настройки при перезагрузке. Маленький косяк, надеюсь, решат в ближайшее время.",бытовая техника
"Блендер удобный, но чистить его – целое искусство. Каждый раз приходится тратить больше времени на это.",бытовая техника
"После покупки холодильника отмечу его вместительность и стиль. Но вот датчик температуры иногда дает сбой. В общем, рекомендую с учетом этого минуса!",бытовая техника
"Моющий пылесос работает шустро, но иногда забивает кисти. Надеюсь, производитель исправит это в будущем.",бытовая техника
"Приобрел микроволновку за приемлемые деньги, но она громко работает, даже при минимальной мощности. Буду искать более тихую модель.",бытовая техника
"Кухонная плита отлично греет, но управление сложное и не интуитивно понятное. Сложности при первых настройках.",бытовая техника
"Стиральная машина сэкономила время, но расходует воду по-другому. Попробую найти более экологичную модель.",бытовая техника
"Вентилятор справляется со своей задачей, но шумноват. Буду искать более тихий вариант.",бытовая техника
"Утюг быстро нагревается, но пластиковая ручка нагревается и становится жаркой. Ищу утюг с более надежной隔热把手.",бытовая техника
"Блендер хорошо разбивает куски, но часто отваливаются металлические части. Буду искать блендер с более долговечным строением.",бытовая техника
"Купил посудомоечную машину, все чистит идеально, только расход воды большой, разочарован.",бытовая техника
"Вещь превзошла все ожидания! Супер мощная и тихая, рекомендую!",бытовая техника
"Микроволновка отлично себя показала, но в ней нет функции гриля, это немного разочаровывает.",бытовая техника
"Холодильник впечатляет, только полки снизу часто скользят, вот это немного напрягает.",бытовая техника
Утюг - просто чудо! Он действительно быстро и качественно глажет одежду. Спасибо продавцам!,бытовая техника
"Была впечатлена качеством стиральной машины. Она работает шумно, и это меня немного раздражает.",бытовая техника
"Имейте в виду, что вакуумная пылесос может не справиться со сложными загрязнениями. Но в целом работает замечательно!",бытовая техника
"Да, это дорогое качество. Но мое личное мнение - оно стоит этих денег. Удобно и эффективно!",бытовая техника
"Всем советую этот холодильник! Мощный, тихий и стильный. Не жалею о покупке!",бытовая техника
Покупка пошла не так гладко. Проблема с мигающим светодиодом. Обслуживание долго и неэффективное.,бытовая техника
"Кофеварка работает отлично, когда она работает. Но периодически выключается без предупреждений. Это немного напрягает.",бытовая техника
Мой опыт с микроволновкой был неудачным - слишком часто выходят из строя. Следующий раз буду искать более надежную модель.,бытовая техника
"Эта посудомоечная машина очень тихая и экономит воду. Пользуемся ею уже год, и все отлично!",бытовая техника
"Был разочарован моим телевизором. Цвета выглядят не натурально, а звук слабый. Деньги потрачены, но не возвращаются.",бытовая техника
Пылесос работает отлично при правильном уходе и обслуживании. Но цена на запчасти слишком высокая.,бытовая техника
"Эта стиральная машина просто шикарная, особенно для ценителям удобства и чистоты. Отличное соотношение цена-качество.",бытовая техника
"Ах, эти микроволновки! Так и хочется кричать Ура! за быстрый нагрев и удобство использования. Но... Осталось лишь пожалеть о том, что не выбрала модель побольше. В общем, рекомендую!",бытовая техника
"Влюбилась с первого взгляда, но потом... Быть может, мне просто не повезло, но этот стиральный автомат работает настолько медленно, что мне хотелось бы внести жалобу. Советую осторожно к выбору.",бытовая техника
"Небольшая кофеварка, но она не только милая, но и функциональная. Мне кажется, я нашла свою любовь! Спасибо за вкусный кофе прямо у меня дома!",бытовая техника
"Сама по себе холодильная коробка неплоха, но... Наступает момент, когда даже самый большой морозильник не хватает пространства. В общем, не могу сказать, что безнадежно влюблена.",бытовая техника
"Был уверен, что мой новый блендер станет основным помощником в моей кухне, но он постоянно дает сбои. Буду искать более надежный вариант.",бытовая техника
"Этот духовой шкаф просто замечательный. Его дизайн приятен глазу, а функциональность - просто превосходна! Я в восторге!",бытовая техника
"Конечно, это не самая дорогая утюг, но... Он не в состоянии справиться с ужасной складчатостью моего пиджака. Не советую.",бытовая техника
"Сразу после покупки почувствовал, что эта посудомоечная машина была создана с любовью. Она работает бесшумно, и уборка посуды происходит на высшем уровне. Рекомендую!",бытовая техника
"Купил новый посудомоечный агрегат, на первый взгляд всё замечательно, но вот когда стал использовать - обнаружил что-то странное. Вода ведет себя неожиданно, иногда не выходит вообще. Не знаю, что делать, может кто сталкивался с такой проблемой?",бытовая техника
"Искал микроволновку долгое время и остановился на этой. На самом деле она работает отлично, готовит быстро и равномерно. С удовольствием рекомендую.",бытовая техника
"Недавно купил холодильник, который обещал быть очень тихим. Но по ночам это ощущение слуха полностью исчезло. Громкость работы холодильника настолько высока, что мешает спать. Думал, это проблема с моим домом, но оказывается нет. Могу посоветовать только если вам нужно много шума.",бытовая техника
"Моющий пылесос - идеальное решение для занятого человека. Он справляет все сам и делает это отлично. Несомненно, рекомендую его всем, кто хочет экономить время.",бытовая техника
"Блендер оказался немного слабее, чем я ожидал. Пудинг и смузи не перемешиваются очень хорошо. Может стоит обратить внимание на более мощную модель.",бытовая техника
"Этот стиральный автомат действительно экономит воду и электричество, что приятно. Однако, иногда он не справляется с трудными пятнами.",бытовая техника
"Газовая плита, которую выбрал, обладает замечательной управляемостью и эффективностью. Каждый член семьи ей довольны.",бытовая техника
Приобрел новую посудомоечную машину и очень доволен. Она тихо работает и моет посуду идеально. Советую!,бытовая техника
"Этот стиральный автомат просто замечательный. Всегда работает шустро, даже при большом объеме белья. Не пожалел, что приобрел!",бытовая техника
"Сложно понять инструкцию к микроволновке, а когда все же разберешься - окажется, что функций слишком много и не все понадобятся.",бытовая техника
"Квартира стала чище благодаря моему новому пылесосу. Он легко собирает пыль и грязь, только вот иногда ведет себя странным образом, непредсказуемо срабатывает.",бытовая техника
"Холодильник не впечатлил своей вместимостью. При всем своем размере он вмещает меньше продуктов, чем ожидалось.",бытовая техника
"Недавно купил кофеварку, но она постоянно пропускает кофе, из-за чего утром приходится позавтракать еще вчера.",бытовая техника
"Телевизор с высоким разрешением, но качество картинки в ночное время суток ужасное. Жаль, что такая важная деталь была проигнорирована.",бытовая техника
"Мой новый посудомоечный автомат работает как часы, но есть одна проблема - он периодически забивает воду, требуя чистки.",бытовая техника
"Был рад покупке новой утюг, пока он не начал сильно хрипеть и отказываться от работы через несколько недель после покупки.",бытовая техника
"Сам по себе холодильник хороший, но когда он включен, издает довольно громкий шум. Понимаю, это не критично, но немного раздражает. Продукты хранятся хорошо, только нужно следить за уровнем шума.",бытовая техника
"Уже месяц пользуюсь микроволновкой, впечатления одни - классная вещь! Супер удобно, габариты нормальные, функционал на высоте. Советую всем!",бытовая техника
"Этот пылесос очень сложен в использовании, инструкция написана на иностранном языке. В остальном неплохо, но нужно время на адаптацию.",бытовая техника
"Блендер работает отлично, мощь! Только вот цена... Стоит дорого, думаю, что можно найти более доступные альтернативы.",бытовая техника
"Холодильник очень прост в использовании, и на первый взгляд, все хорошо. Но уже через месяц у него начался стук внутри. Надеюсь, сервис быстро решит проблему.",бытовая техника
"В целом, телевизор удовлетворяет заявленным характеристикам. Но если вы любите высококачественные фильмы, то этот вариант может вас разочаровать.",бытовая техника
"Мое мнение об этой посудомоечной машине - она неплоха, но есть некоторые недостатки. Зато цена очень привлекательная.",бытовая техника
"Купил чайник, который обещал приготовить воду за 3 минуты. На деле - 5 минут. Больше всего разочаровалась в этом.",бытовая техника
Ну и бредятина эта пылесос! Он даже не может самостоятельно поднимать свои ноги после падения... Не рекомендую!,бытовая техника
"Очень порадовало качество этого холодильника. Удивительно, как он сохраняет свежесть продуктов. Плюс ко всему, очень эргономичный дизайн. Молодцы!",бытовая техника
"Телевизор просто впечатляет. Я даже и не знал, что могу смотреть так много каналов! Но цена на него... Да ладно, я счастлив!",бытовая техника
Это просто ужас. Стиральная машина постоянно выдает ошибки и не всегда сушит вещи должным образом. Не советую.,бытовая техника
"Микроволновка, которая мне понравилась, благодаря своей простоте в использовании. Очень удобная и практичная модель.",бытовая техника
Этот кофеварка просто неудобная. Где же ручка? Приходится каждый раз держать его за корпус. Бездумно покупать не советую.,бытовая техника
"Вентилятор работает замечательно, даже при максимальной мощности шум совсем не слышно. Качество впечатляет!",бытовая техника
"Сушильная машина не сушит. Может быть, стоит обратиться в сервис, но пока я сижу с мокрыми вещами.",бытовая техника
"Буду честным - впервые столкнулся с проблемой, когда холодильник перестал замораживать. Модель отмечена высокой стоимостью, но на практике показывает низкое качество. Сожалею, что купил.",бытовая техника
"Впечатление от стиральной машины - супер! Качественная работа, даже при малом расходе воды и энергии. Не жалею об этом покупке!",бытовая техника
Безумно разочарован в пылесосе - он не собирает волосы на коврах. Производитель должен был продумать этот момент лучше.,бытовая техника
"Кофеварка на все 5 баллов! Простая в использовании, удобная, быстро и качественно готовит кофе. Рекомендую!",бытовая техника
"Телевизор хорош, но цена... Больше не куплю дорогие бренды. Надо смотреть на качество работы, а не на марку.",бытовая техника
"Электрочайник супер-быстрый и удобный, но пластиковые детали довольно быстро изнашиваются. Не уверен, стоит ли ему доверять.",бытовая техника
"Вентилятор работает шумновато, но это компенсируется его эффективностью. Очень рад, что купил.",бытовая техника
