text,category
"Купил пару ботинок, но они мне не подошли по размеру. Очень разочарован в этом аспекте.",обувь
"Обувь в целом неплохая, но кожа быстро линяет, немного расстроило.",обувь
"Очень расстроен покупкой. Обувь быстро изнашивается. Ожидания были выше, чем получилось. Не советую.",обувь
"Купил эти ботинки по акции, дешево, но качеством очень не обрадовался. Подошва быстро теряет форму после нескольких прогулок. Бюджетная модель, как я понимаю.",обувь
Впечатление от покупки - положительное! Спортивные кроссовки идеально подойдут для тренировок. Качество материала и удобство - отличные.,обувь
"Удивлен низким качеством обуви по высокой цене. Кожа легко рвется при носке. Надеюсь, цена соответствует качеству у других производителей.",обувь
"Отличная обувь, которая выдерживает активные нагрузки! Покупал в основном для бега и спорта. Очень рад своим покупкам.",обувь
Очень разочарован в этих туфлях. После одной недели носки они уже начали деформироваться. Не рекомендую.,обувь
"Мне очень нравятся ботинки, которые я купил. Они отлично подходят для повседневной носки. Ценой за них стоит качество.",обувь
"Обувь приятная по цене и стилю, но качество оставляет желать лучшего. Слабо прокладывается вода и быстро начинают исцарапываться.",обувь
"Купил эти кроссовки по супер скидке, но сначала было сложно понять, что за странный материал, который идет на подкладку. Оказалось довольно жестким и неудобным для первоначального использования. Но в целом обувь выглядит красиво и качественно.",обувь
Очень расстроен покупкой этих туфель! Ноги в них болели после первого дня. Материал и форма подошвы не идеальны. Но цена была очень привлекательной.,обувь
"Эти ботинки выглядят отлично, но сначала были трудноваты для надевания. Материалы из которых они сделаны, мягкие и приятные к ногам, но я все равно ожидаю от обуви большего удобства.",обувь
"Мне кажется, что эта обувь стоит своих денег. Они выглядят классно и весьма комфортны при ходьбе. Не могу сказать, что они идеальны, но за такую цену - отличный выбор.",обувь
"Идеальная обувь для прогулок на свежем воздухе. Она столь удобна и комфортна, что я забыл, что носить обувь - это какая-то боль. Спасибо!",обувь
"Слишком дорогая цена за такую обувь. Я ожидал большего от этих ботинок, они не такие удобные, как мне хотелось бы. Не рекомендую покупать их.",обувь
"Этот стиль обуви не подходит мне. Я использовал их пару раз и уже понял, что они просто не для меня. Объективно говоря, обувь качественная, но мне она не понравилась.",обувь
"Я в восторге от этих сапог. Они выглядят великолепно, удобно сидят на ноге и идеально подходят для моего стиля. Пожалуйста, продолжайте производить эту модель!",обувь
"Ботинки классные, но подошва скользит на мокром полу. В остальном - хвалебно!",обувь
"Встреча была в стиле кроссовков с высокими телесными ботинками, но не очень удобно, часто падают на носу.",обувь
"Был в восторге от своей новой пары джинсовых сапог, они смотрятся очень круто и подходит к моему гардеробу!",обувь
Такие кеды просто пропитаны духом школы. Неудобная подошва и жесткое дно.,обувь
"Мне нравится обувь, но она немного уступает по удобству моим старым кроссовкам. Тем не менее, я ее все равно люблю!",обувь
"Слипоны на пике моды! Они комфортные, стильные и идеально подошли для лета.",обувь
"Сапожки замечательно сохраняют тепло в холодную погоду, но они немного узкие. В следующий раз возьму размер побольше.",обувь
Такие классические ботинки имеют все: хороший внешний вид и удобство. Рекомендую!,обувь
"Ох, эти сапоги смотрятся замечательно, но за 20 баксов? Да, это просто сказка! Тот факт, что они устойчивы и удобны, делает их еще лучше. Не могу не поставить плюс!",обувь
"Я купил эти кроссовки с большим энтузиазмом, но они оказались слишком маленькими. К сожалению, я не смог найти свой размер. Буду держать в уме при следующей покупке.",обувь
"Весна и лето - это для босоножек! Эти облегающие босоножки смотрятся отлично на ноге. Мне только жаль, что их сложно носить на дождливых весенних днях.",обувь
"Я надеялся, что мои новые туфли станут моим главным аксессуаром, но они оставили меня разочарованым. Они не так устойчивы, как я ожидал. Следующий раз буду внимательнее к выбору обуви.",обувь
"Покупка была ошибкой! Эти ботинки из натуральной кожи не подошли мне по размеру. Моя ошибка в том, что я не проверил размер перед покупкой. Жаль, что теперь мне придется возвращать их.",обувь
"Ботинки, которые я купил, великолепны по форме и цвету, но они кажутся довольно жесткими. Возможно, через пару месяцев они станут более комфортными, но пока я носить их с опаской.",обувь
"Приятная цена, но качество обуви ниже ожидаемого. Носки уже начинают протираться. Буду искать другие варианты в будущем.",обувь
"Все супер! Эти сапоги идеально подходят для зимнего сезона. Тёплые, стильные, и устойчивые. Я доволен своей покупкой!",обувь
"Сначала смотрелся классно, но через месяц ужасно потёрся. Не советую.",обувь
"Великолепная обувь! Надо сказать, что цена/качество на высоте. Мой выбор!",обувь
"Хорошо сидит, удобно, но стелька съедается довольно быстро. Стоит дороже аналогов на рынке.",обувь
"Мне не понравилось, узковата и тесно. Ожидал большего от бренда.",обувь
"Стоило покупки - качественная обувь, долговечная. Очень рекомендую!",обувь
"Обидно, что из-за дешевизны обуви, она и сдохла через пару месяцев. Не рекомендую.",обувь
"Отличная обувь, стильная и удобная. Буду использовать ее как вторую пару лет. Рекомендую!",обувь
"Заказал на спутниковой почте, пришел в коробке. Качество нормальное, но мне не подошло по размеру. Советую уточнить размер перед покупкой!",обувь
"Удивился качеству этих ботинок за такую цену! Могу сказать - они надёжны и удобны. Стоит иметь в виду, что изначально может быть некоторое неудобство при первоначальной носке. В общем, рекомендую!",обувь
"Ожидал большего от этих сапог. Покупал для зимы, но на практике обнаружил, что они довольно сырые и не обеспечивают достаточного утепления. Не советую.",обувь
"Эти туфли просто прелесть! Красивый дизайн, комфорт и долговечность. Они выглядят немного дорогими, но это стоило того. Однозначно рекомендую!",обувь
"Большой разочарование! Обувь очень быстро износилась и деформировалась. Не могу рекомендовать, если хотите долговечную обувь.",обувь
Впечатление от обуви положительное. Удобно и стильно. Однако размеры могут быть немного некорректны по сравнению с указанными на упаковке.,обувь
"Увы, не все гладко. Продавец обещал доставку в течение двух дней, но я ждал неделю. Обувь сама по себе хорошая, но сервис - нет. Напрямую с продавцом не связался.",обувь
"Идеальная обувь для ходьбы. Очень удобная и комфортная. Цена в меру, но я бы сказал, что она может быть еще ниже. В целом, рад покупкой.",обувь
"Недоволен обувью, слишком тесно. Следует учесть, что они явно малы по сравнению с моим обычным размером. Советую подбирать размер больше своего.",обувь
"Носил новые кроссовки пару дней, и они уже изнашиваются. Не ожидал такого от дорогой обуви. Не рекомендую!",обувь
"Мои новые ботинки на каждый день просто чудо! Очень удобные, стильные и держат тепло. Рекомендую!",обувь
Очень разочарован в этих сапогах. Изготавливают их явно из дешевой кожи. Больше не буду покупать эту марку.,обувь
"Мне эти кеды поставили звездочку на стопу. Возможно, мне просто не подходит размер, но все равно разочарован. Не советую!",обувь
"Заказал черные туфли, получил бежевые. Ожидал качественный материал, а получил низкое качество. Не советую!",обувь
"Обувь идеальна по форме и цвету, но она очень скользкая. Буду вынужден искать другое решение.",обувь
"Ботинки отлично сидят на ноге, и я вижу, что они устойчивы. Я в восторге от этого продукта!",обувь
"Покупкой довольны, но цена слишком высокая за такую обувь. Надеюсь, они будут служить долго.",обувь
"Долго искал хорошие кухонные ножи, и вот они! Супер острые, красиво выглядят, только вот рукоятка скользкая при использовании. Рекомендую!",посуда
"Стоит своих денег! Качество отличное, столовые приборы изюминка в дизайне. Только вот цена могла бы быть немного ниже.",посуда
"Использовал кастрюли на кухне долгое время, но эта модель впечатляет. Хорошее качество, удобная форма. Однако, цена не самая дешевая.",посуда
"Тарелки очень стильные, цвет приятный. Но качество может быть лучше, особенно при интенсивном использовании.",посуда
"Посуда из нержавеющей стали - надежно, но мне кажется, что цена за качество слишком высока. Пользуюсь ею месяцами, но есть некоторые отклонения в качестве.",посуда
"Посудомоечная машина работает хорошо, но иногда забивает сеть. Не дешево, но эффективно.",посуда
"Приобрёл набор чашек, они красивые и вместительные, но материал по-моему немного тонкий. Качество не такое высокое, как ожидалось.",посуда
"Мне понравилась функциональность столового набора, но учитывая его стоимость, жду большего качества.",посуда
"Мне понравился дизайн этого чайника, но вот качество... Оно оставляет желать лучшего. Вода начала сыпаться через 2 месяца. Пожалуйста, не покупайте.",посуда
Я люблю эту посуду за ее прочность и стиль. Единственная проблема - она слегка скользит в руке при мытье. Но все остальное просто замечательно!,посуда
"Это блюдо выглядит отлично на столе, но материал слишком хрупкий. За полгода я уже два раза исправил его в мусор. Не рекомендую.",посуда
"Недавно купила эти стаканы и в восторге. Они красивые, стойкие и легко чистятся. Качество отличное, рекомендую!",посуда
"Очень разочарован в этих тарелках. Я думал они будут более прочными, но через месяц одна из них сломалась. Даже не советовал бы им.",посуда
Этот чайник - настоящая находка! Он нагревает воду быстро и работает бесперебойно. Пользуюсь ежедневно и доволен.,посуда
"Бутылки для воды очень удобны и вместительны, но после пары месяцев пользования на их крышках появляются дефекты. Это разочарование!",посуда
"Приятные глазу цвет и форма, но качество столового набора оставляет желать лучшего. Посуда пошла трещинами через пару недель. Больше не рекомендую.",посуда
"Купил набор столовых приборов, но они почему-то все разваливаются после первой стирки. Буду смотреть другие варианты. 😣",посуда
"Самые лучшие кухонные принадлежности, которые я видел! Материал прочный, легко чистится, радует качество. 👍",посуда
"Встречал более дешевую посуду, но качество ее оставляет желать лучшего. Эта посуда стоит своих денег. 👫",посуда
"Мне кажется, что эта посуда предназначена для детей. Она слишком тонкая и легко сломается. 😨",посуда
"Сервиз выглядел замечательно на картинке, а в жизни... он оказался совсем другим. Цвет и качество не соответствуют описанию. 🙄",посуда
"Заказывал кастрюлю с крышкой. Крышка приходит к ней не на место, что делает процесс готовки неудобным. Не рекомендую. 🚫",посуда
"Отличная посудина, которая выдерживает серьезное тестирование посудомоечной машины. Всем советую! 👌",посуда
Не понравился материал посуды - он быстро окисляется и начинает издавать странный запах. Поиск далее продолжается. 🧹,посуда
"Очень разочарован, когда купил эти стаканы, ожидая что они будут прочными, но уже через неделю одна из них сломалась. Стоит внимания.",посуда
Я люблю эту серию посуды! Просто замечательная прочность и стильный дизайн. Каждый раз радуюсь покупке!,посуда
"Этот набор чайных чашек отлично подходит для кофе. Только жаль, что цвет не совсем соответствует фотографии на сайте. Но все равно радует.",посуда
"Сразу после первого пользования, обнаружил, что это очень хрупкая посуда. Буду осторожнее. В остальном, цена - качество хорошее соотношение.",посуда
"Посуда великолепная, особенно смотрится на столе. Немного боялся за её прочность, но пока все в порядке.",посуда
"Откровенно говоря, я ожидал большего от этого продукта. Не держится на руках, чувствуется некачественное производство.",посуда
"Идеально для использования в мультиварке. Остался доволен этим приобретением, цена соответствует качеству.",посуда
"Мне понравилось качество и внешний вид столового набора. Важно, что они легко чистятся и долговечны.",посуда
"Ура за эти кастрюли! Они не только красивые, но и удобные в использовании. Моя любимая кастрюля для выпечки стала моим новым фаворитом в кухне. Рекомендую!",посуда
Очень разочарован. Посуда не выдержала двух месяцев и начала трескаться. Не ожидал такого качества от этого бренда.,посуда
"Мне понравилась посуда из стекла. Хороший выбор для тех, кто хочет экологичные решения, но иногда стекло подвергается небольшим повреждениям при ударах.",посуда
"Эта кастрюля отличается своей прочностью и практичностью, она отлично сохраняет тепло. Я бы рекомендовал её другу.",посуда
Был приятно удивлен качеством металлической сковороды. Она легко очищается и отлично传热。唯一的问题是价格有点高。,посуда
"Приобрел набор посуды, однако цвет и качество не соответствуют описанию на сайте. Не советую.",посуда
"Стильная瓷盘, но они легко царапаются. Если вам важна долговечность, вам лучше выбрать более устойчивые к царапинам материалы.",посуда
Идеальное соотношение цены и качества. Эти чашки идеально подходят для ежедневного использования. Рекомендую!,посуда
"Купила сковороду, осталась довольна! Не прилипают блюда, легко моется, рекомендую!",посуда
Больше всего понравилась кухонная термометр - точный и удобный в использовании. Рекомендую товар.,посуда
Недавно купил таблетки для чистки посуды и они оказались очень эффективными. Однозначно рекомендую!,посуда
"Очень разочарован, полировка посуды уже отвалилась после первого же использования. Несмотря на стильный вид, советую подумать дважды перед покупкой.",посуда
"Недешевая столовая посуда, но качество соответствует цене. Отличное отношение цена-качество. Рекомендую!",посуда
"Пользуюсь стаканами уже несколько лет, они не трескаются, не потускневают и не изменяют цвет. Отличный продукт!",посуда
"Удобные кухонные принадлежности, но они издают много шума при использовании. Для меня это большой минус. Не уверен, стоит ли рекомендовать.",посуда
"Супер держит тепло, удобно держать в руках, отлично сохраняет тепло. Очень доволен своим выбором. Рекомендую!",посуда
"Очень разочарован в этих стаканах. Заказал их, думая, что они будут ст�ло-хрустальными, а на деле это обычный пластик. Не рекомендую.",посуда
Настоящее спасение для моей кухни. Блюда смотрятся просто великолепно и удобны в использовании. Советую!,посуда
"В общем, товар средний. Качество могло бы быть лучше. Цена за него высока. Потенциальным покупателям советовал бы сначала посмотреть на другие варианты.",посуда
