text,category
"Мне понравился общий вид этого комплекта, но после пары дней использования, я поняла, что он слишком сложный в уходе. Ожидал большей практичности.",украшения и аксессуары
"Браслет смотрится великолепно, но его сложно надеть самой себе без помощника. Может, стоит продумать упаковку лучше для этого.",украшения и аксессуары
"Удивительно, как эта ручка изящна и удобна в использовании. Розетка для зарядки могла бы быть сделана лучше.",украшения и аксессуары
"Ах, эти браслеты, просто прелесть! Они так красиво смотрятся на молом запястье и в них я чувствую себя настоящей принцессой. Но только одно, они довольно быстро теряют свежий вид, после одного-двух уходов. Более того, цена - это настоящая уловка, выглядит как дешевое золото, а обнаруживается что-то совсем другое...",украшения и аксессуары
"Держу свои покупки под стеклом, они вроде как золотые, но суть в том, что они слишком блестят и на самом деле не имеют никакого значения. Если вам нужно что-то более серьезное и долговечное, это не то место, куда следует обратиться. Я думаю, это только пригодится для косплея.",украшения и аксессуары
"Эти серьги настолько классные, что я уже хочу добавить еще пару моделей в свой гардероб. Они красиво смотрятся в любом стиле, и моя кожа не страдает от их ношения. Это то, что мне и нужно!",украшения и аксессуары
"Я ожидала больше от этих браслетов. Их форма и цвет действительно выглядят интересно, но они слишком хрупкие. Слишком быстро потерлись и изменили цвет. Не уверен, стоит ли рекомендовать их в долгосрочной перспективе.",украшения и аксессуары
"Эти бусы были полной разочарованием. На картинке они выглядели более привлекательными и дорогостоящими, но в жизни все было иначе. Цепочка была короткой, а камни были слабо соединены. Не рекомендую!",украшения и аксессуары
"Удивительно! Это то, что я искал. Красивое, стильное, качественное украшение в моем коллекционном мешке. Никаких недопониманий и нет ни малейших сомнений в их ценности. Однозначно рекомендую!",украшения и аксессуары
"Серьги отличного качества. Они в точности соответствуют описанию и фото. Надеюсь, что они выдержат время. Я счастливый владелец!",украшения и аксессуары
"Ну, это был странный выбор. Украшение смотрится хорошо, пока ты его надеваешь, но стоит тебе его носить, оно начинает скрипеть и щелкать. Мне не понравилось.",украшения и аксессуары
"Браслет очень красивый, но немного тяжеловат на руке, все равно рекомендую!",украшения и аксессуары
"Кольца с бриллиантами, шикарное качество, но цена высока для моего бюджета.",украшения и аксессуары
"Серьги очень оригинальные, но мне не понравилась форма держателя на ухе.",украшения и аксессуары
"Очки солнцезащитенные - они стильные, но стекло слишком тонкое.",украшения и аксессуары
"Браслет из медицинского сплава - очень стильный, но мне кажется, он слишком дорог для своего качества.",украшения и аксессуары
"Почувствовал себя настоящим королем в этих перстнях, отличное качество и стиль. Рекомендую!",украшения и аксессуары
"Серьги с кристаллами - они красивые, но их слишком трудно надеть.",украшения и аксессуары
"Все мои друзья завидуют моему новый колье - стильное, уникальное и качественное!",украшения и аксессуары
"Очень красивые серьги, только вот камни не так яркие, как ожидала. Цена вполне адекватная!",украшения и аксессуары
"Акцентное украшение в моем гардеробе! Несмотря на то, что немного тяжеловато, но это компенсируется его уникальностью.",украшения и аксессуары
"Невозможно найти браслет подобного качества за такую цену. Однако, материал, хоть и пластиковый, быстро деформировался.",украшения и аксессуары
"Влюбилась в эти кольца, цвет просто прекрасный. Но они довольно большие для моего мелкого пальчика. Советую только тем, кому нравятся крупные украшения!",украшения и аксессуары
Такие стильные очки! Но слишком громоздко смотрятся с одеждой для повседневной жизни.,украшения и аксессуары
"Браслет просто шикарный! Мне понравился общий стиль, но размер оказался немного больше, чем я ожидала. Но это легко исправить при выборе следующего изделия.",украшения и аксессуары
"Очень разочаровалась в этих подвесках. Они не так весомые и дорогие, как выглядят на сайте. Не рекомендую.",украшения и аксессуары
"Кольца в точности соответствуют фотографиям, очень довольна. Но мне кажется, они могли бы быть немного удобнее для носки.",украшения и аксессуары
"Кольца из золота - прелесть! Красивые, качественные и стильные. Рекомендую!",украшения и аксессуары
Очень разочарован в браслетах. Не выдержали две недели и начали сыпаться.,украшения и аксессуары
"Серьги из стекла - чудесно! Цвет передают ярко, смотрятся очень эффектно.",украшения и аксессуары
"Носила платки на мероприятиях, но они быстро потеряли форму. Ожидали большего.",украшения и аксессуары
"Восторг от ободков, особенно с подсветкой, в темноте просто зажигают!",украшения и аксессуары
"Стильные и качественные серьги, но цена высока для меня.",украшения и аксессуары
Заколки для волос - лучший выбор! Они красиво сидят и не скользят.,украшения и аксессуары
"Невозможно поверить, что такие красивые сережки стоят столько дешево. Влюблена!",украшения и аксессуары
"Он просто супер, я не могу поверить в эту цену! Мой новый браслет стал настоящим хитом моего гардероба!",украшения и аксессуары
"Мне не понравилось качество камней - они быстро поблекли. Не стоит того, что стоит покупка.",украшения и аксессуары
"Браслет смотрится красиво, но металлическая фурнитура сломалась через несколько недель. Разочарован.",украшения и аксессуары
"Очень красивый, но немного больший размер, чем ожидала. Следующий заказ буду внимательнее изучать размеры.",украшения и аксессуары
"Брошь просто волшебная, она стала акцентом моего образа. Цвет и форма - идеальный выбор!",украшения и аксессуары
"Заказ был утрачен в пути. Очень печально, ведь был долгожданным подарком.",украшения и аксессуары
"Брала серьги как подарок на день рождения, но они пришли с дефектами. Очень разочарована.",украшения и аксессуары
"Серьги замечательные, цвет подходит к любому наряду. Рекомендую для покупки!",украшения и аксессуары
"Боже, эти серьги - шедевр! Они идеально подчеркивают мой образ. Только не забудьте, что они могут быть слегка дороги, если вы ищете бюджетный вариант.",украшения и аксессуары
"Кольца из этой коллекции - волшебство! Они великолепно смотрятся на руке и придают любому наряду яркости. Я только жалею, что не могу найти больше столько же.",украшения и аксессуары
"Я люблю все, что связано с этническим дизайном, и эти браслеты - превосходное дополнение к моему гардеробу. Они немного скрипят, но это добавляет им характера!",украшения и аксессуары
Впечатлен качеством этих часов! Они красиво смотрятся на руке и имеют отличное времяпретечение. Один минус - браслет может легко цепляться за одежду.,украшения и аксессуары
"Серьги были вдохновением, но их качество меня разочаровало. Они стали слишком светлыми после нескольких ношений и стали скрипеть при носке. Не рекомендую!",украшения и аксессуары
"Эти украшения из пластика - сюрприз! Они красивые, но не очень прочные. Наверное, не стоит рассчитывать на долгий срок службы.",украшения и аксессуары
"Заколка для волос была моим экспериментом, и она выдержала его. Она не сползает и идеально закрывает макушку. Только она может быть немного больше размером.",украшения и аксессуары
"Ну, я бы не сказал, что я влюбился в эти броши. Они не очень выделяются и могут казаться слишком простыми. Возможно, лучше подбирать броши с более выразительным дизайном.",украшения и аксессуары
"Ох, эти серьги просто манят глаз! Они в точности такие, как на фото, а цвет - настоящий шоколад. Но они немного маловаты. Рекомендую!",украшения и аксессуары
"Этот браслет выглядит немного дешево, качество материалов не особо высокое. Мне жаль, что я его купил.",украшения и аксессуары
"Брошь просто чудо! Такой красивый и яркий. Купить я его не могла, так как он стал центром внимания на всех моих мероприятиях. Плюс цена очень приятная!",украшения и аксессуары
"Серьги в виде цветов впечатлили меня своей яркостью и свежестью. Но они быстро потерлись и потеряли первоначальный блеск. Не стоит покупать, если ищете долгосрочный аксессуар.",украшения и аксессуары
"Этот кулон, казалось бы, прекрасен по своим характеристикам, но оказался слишком громоздким при носке. Впрочем, качество очень хорошее.",украшения и аксессуары
"Серьги просто идеальные! Материалы качественные, цвет насыщенный и яркий. Я надеюсь, что этот аксессуар будет служить мне долгие годы. Рекомендую!",украшения и аксессуары
"В общем, браслет понравился, только размер не подходит. Мне жаль, что я его купил. Может, вам повезет.",украшения и аксессуары
"Кольцо выглядит просто волшебно, особенно под светом. Но я боюсь, что оно слишком больших размеров, нужно было выбирать размер поменьше. Качество отличное.",украшения и аксессуары
"Очень красивое кольцо, но оно слишком большое. Ожидал более точного подбора размера. Стоимость - это единственный плюс.",украшения и аксессуары
"Абсолютно влюбилась в эти серьги! Настолько яркие и уникальные, что привлекают все внимание. Замечательное качество за эти деньги!",украшения и аксессуары
"Впечатление от этого браслета осталось смешанным. Он красивый и стильный, но материал кажется немного дешевым. Не уверен, стоит ли его покупать.",украшения и аксессуары
"Эти украшения стали моим фаворитом после покупки. Они качественные, красивые и имеют отличную цену-качество. Рекомендую!",украшения и аксессуары
"Удивлен своим выбору. Серьги не соответствуют описанию, слишком мелкие и простые по сравнению с ожиданиями. Не рекомендую.",украшения и аксессуары
"Браслет просто великолепен! Он красивый, качественный и носится удобно. Если ищете что-то недорогое и стильное - это ваш выбор!",украшения и аксессуары
Недоволен качеством этого кольца. Камень выглядит искусственным и быстро потеряет свой блеск. Не советую.,украшения и аксессуары
"Бижутерия очень красивая и стильная, но пластиковые материалы сделали ее недолговечной. Держите в уме при покупке!",украшения и аксессуары
"Свингеры смотрятся классно и очень удобны для ежедневного ношения. Ткань мягкая, не стесняет пальцы. Спасибо продавцу за быструю доставку!",украшения и аксессуары
"Серьги красивые, но материал слишком дешевый - они уже сломались через две недели. Деньги жалко, но в общем, не рекомендую.",украшения и аксессуары
"Кольца с подвесками - прелесть! Они выглядят намного дороже, чем стоили, и отлично смотрятся. Буду заказывать ещё раз!",украшения и аксессуары
"Браслеты из глины? Не уверен, что это идеальный выбор. Ощущение дешевизны, особенно по сравнению с металлическими вариантами.",украшения и аксессуары
Броши-бабочки просто шикарные! Они добавляют изюминку в любое нарядное платье. Рекомендую всем любителям оригинальных украшений.,украшения и аксессуары
"Монограммы на сумках - классно, но они впитывают влагу и грязь. Нужно всегда иметь с собой сухую чехол или чистящий спрей.",украшения и аксессуары
Очки-люкс - великолепные! Они придают мне интеллектуальный облик и очень удобны для чтения. Однозначно рекомендую!,украшения и аксессуары
"Браслеты-кости - стильные и оригинальные. Но они довольно тяжелые и быстро устаешь от их ношения. Может быть, стоит найти более легкий вариант?",украшения и аксессуары
"Очень красивая брошь, как на фото! Не ожидала такого качества за такую цену. Рекомендую!",украшения и аксессуары
"Браслет с золотом... Сначала был в восторге, но через месяц он начал терять свой цвет. Обидно.",украшения и аксессуары
"Кольцо, которое я купила - оно красивое, но немного великовато. Размеры могли бы быть лучше.",украшения и аксессуары
"Удивительно, что такие аксессуары стоят столько. Качество их не соответствует цене. Огорчен.",украшения и аксессуары
"Бусы с камнями, красивые на вид, но на шее выглядят довольно тяжелыми и не удобно.",украшения и аксессуары
"Заказывал пendent, который по обещанию был белого золота, а получили серебро. Не честно!",украшения и аксессуары
"Все красиво смотрится на картинке, но на实物 it выглядит скучно и не так ярко. Замечу это.",украшения и аксессуары
"Красивые серьги, но они слишком большие для моего уха, и мне приходится постоянно их отпинать. Недостаток.",украшения и аксессуары
Очень стильный и классный браслет. Он действительно выделяется на моем запястье. Цвет точно как на сайте. Рекомендую!,украшения и аксессуары
"В общем и целом понравилось. Кольцо красивое, но слишком легко раскачивается на пальце, что немного разочаровало.",украшения и аксессуары
"У меня есть пара сережек и я остался полностью доволен. Они красивые и качественные, но мне жалко их потерять.",украшения и аксессуары
"Довольно разочарован, они не выглядят как на фото. Цвет несколько темнее и материал не такой гладкий.",украшения и аксессуары
"Заказал эти часы, надеясь на то, что они будут похожи на дорогие брендовые, но они очень далеки от этого. Материал и качество - на уровне среднего.",украшения и аксессуары
Ношу эти серьги каждый день. Они очень удобные и стильные. Стоит покупки!,украшения и аксессуары
"Ох уж эти аудио-колонки! Звук чудесный, но управление... как будто я должен был изучать космическую технику, чтобы понять его функции.",электроника
"Купил новую планшетку. Мощь! Но грустно, что она не распознает все мои жесты и команды, как обещали в рекламе.",электроника
"Мне эта клавиатура очень понравилась - эргономика, дизайн, удобство в использовании. Но цена... Ох уж это моя карман!",электроника
"Беспроводная мышка? Супер! Экраны и батареи не нужны - просто супер. Но у меня есть одно но. Когда вы нажимаете на кнопку мыши, она не всегда работает правильно. Это мелкая проблема, но...",электроника
"Покупкой телефона очень доволен, он мощный и быстро работает. Но батарея не хватает времени на полную зарядку. Это становится заметно по мере использования.",электроника
"Микрофон в наушниках великолепен, звук чистый и четкий. Но когда нужно вставить наушники, они слишком большие и могут стеснять ухо.",электроника
"Эта камера просто невероятная, ее качество фотографий удивляет. Но время загрузки иногда слишком большое, я жду, когда уменьшится.",электроника
"Телевизор на вершине, я в восторге от яркости изображения и цветопередачи. Но мне кажется, цена может быть снижена.",электроника
"Был рад покупать этот дроны, они действительно круты и удобны для использования! Однако, цена может немного удивить, но если учесть его функциональность, то это все стоит. Советую!",электроника
